{
  "schema_version": "makise.cognitive-decision.v1",
  "proposal": {
    "schema_version": "makise.cortex-proposal.v1",
    "proposal_id": "proposal-drink-water",
    "consciousness_id": "consciousness-human-makise",
    "cortex_frame_id": "frame-evening-001",
    "frame_state_hash": "sha256:1111111111111111111111111111111111111111111111111111111111111111",
    "model_artifact_digest": "sha256:2222222222222222222222222222222222222222222222222222222222222222",
    "semantic_appraisals": [
      { "candidate_id": "appraisal-water-useful", "description": "Available water addresses perceived thirst evidence", "evidence_refs": ["perception-water", "interoception-thirst"] }
    ],
    "goal_candidates": [
      { "candidate_id": "goal-hydrate", "description": "Drink available water", "evidence_refs": ["affordance-drink-water"] }
    ],
    "intention_candidates": [
      { "candidate_id": "intention-drink-water", "description": "Attempt the validated drink action", "evidence_refs": ["affordance-drink-water"] }
    ],
    "plan_steps": [
      { "candidate_id": "step-reach-glass", "description": "Request a motor plan to reach the glass", "evidence_refs": ["affordance-reach-glass"] }
    ],
    "memory_interpretations": [],
    "communications": []
  },
  "disposition": {
    "schema_version": "makise.cognitive-disposition.v1",
    "disposition_id": "disposition-drink-water",
    "proposal_id": "proposal-drink-water",
    "status": "accepted",
    "reason_codes": ["identity-compatible", "physically-feasible"],
    "evidence_refs": ["interoception-thirst", "affordance-drink-water"],
    "decided_by_gate_digest": "sha256:3333333333333333333333333333333333333333333333333333333333333333",
    "reconsideration_trigger": null
  },
  "applied_state_transition": {
    "transition_kind": "cognitive_adoption",
    "caused_by_disposition_id": "disposition-drink-water",
    "adopted_goal_candidate_id": "goal-hydrate",
    "adopted_intention_candidate_id": "intention-drink-water"
  }
}
